{
  "eventId": "90000013-0000-4000-8000-000000000001",
  "eventType": "PolicyRenewed",
  "eventVersion": 1,
  "occurredAt": "2026-09-27T10:00:00Z",
  "aggregateId": "44444444-4444-4444-8444-444444444444",
  "aggregateVersion": 2,
  "correlationId": "ejemplo-contrato",
  "producer": "policy-service",
  "data": {
    "newPolicyId": "55555555-5555-4555-8555-555555555555",
    "previousPolicyId": "44444444-4444-4444-8444-444444444444",
    "renewalId": "88888888-8888-4888-8888-888888888888",
    "customerId": "11111111-1111-4111-8111-111111111111",
    "vehicleId": "22222222-2222-4222-8222-222222222222",
    "newPolicyNumber": "POL-REN-2027-55555555",
    "premium": 1525.5,
    "currency": "PEN",
    "startDate": "2027-10-01",
    "endDate": "2028-10-01"
  }
}
